{
  "$schema": "http://json-schema.org/draft-07/schema#",
  "$id": "https://trading-platform.io/schemas/decision.v1.schema.json",
  "title": "Decision V1",
  "description": "Final trading decision with position sizing",
  "type": "object",
  "properties": {
    "version": {
      "type": "string",
      "pattern": "^\\d+\\.\\d+\\.\\d+$",
      "description": "Schema version in semver format"
    },
    "venue": {
      "type": "string",
      "description": "Exchange/venue name",
      "examples": ["binance", "bybit", "okx"]
    },
    "symbol": {
      "type": "string",
      "description": "Trading pair symbol",
      "examples": ["BTCUSDT", "ETHUSDT"]
    },
    "decision_id": {
      "type": "string",
      "description": "Unique identifier for the decision"
    },
    "decision_time": {
      "type": "string",
      "format": "date-time",
      "pattern": "^\\d{4}-\\d{2}-\\d{2}T\\d{2}:\\d{2}:\\d{2}(\\.\\d{3})?Z$",
      "description": "Time when the decision was made"
    },
    "action": {
      "type": "string",
      "enum": ["open_long", "open_short", "close_position", "no_action"],
      "description": "Trading action to take"
    },
    "signal_ids": {
      "type": "array",
      "items": {
        "type": "string"
      },
      "description": "IDs of signals that contributed to this decision"
    },
    "entry_price": {
      "type": ["string", "null"],
      "description": "Entry price for new positions"
    },
    "stop_loss": {
      "type": ["string", "null"],
      "description": "Stop loss price"
    },
    "take_profit": {
      "type": ["string", "null"],
      "description": "Take profit price"
    },
    "position_size": {
      "type": ["string", "null"],
      "description": "Position size in base currency"
    },
    "risk_amount": {
      "type": ["string", "null"],
      "description": "Risk amount in quote currency"
    },
    "risk_percentage": {
      "type": ["number", "null"],
      "minimum": 0,
      "maximum": 1,
      "description": "Risk as percentage of capital (0-1)"
    },
    "leverage": {
      "type": ["string", "null"],
      "description": "Leverage to use (1 for spot)"
    },
    "confidence": {
      "type": "number",
      "minimum": 0,
      "maximum": 1,
      "description": "Decision confidence score (0-1)"
    },
    "reason": {
      "type": "string",
      "description": "Human-readable reason for the decision"
    }
  },
  "required": [
    "version",
    "venue",
    "symbol",
    "decision_id",
    "decision_time",
    "action",
    "signal_ids",
    "entry_price",
    "stop_loss",
    "take_profit",
    "position_size",
    "risk_amount",
    "risk_percentage",
    "leverage",
    "confidence",
    "reason"
  ],
  "additionalProperties": false
}