{
  "version": "1.0.0",
  "venue": "binance",
  "symbol": "BTCUSDT",
  "decision_id": "dec-btc-1h-001",
  "decision_time": "2024-01-15T11:00:00.000Z",
  "action": "open_long",
  "signal_ids": ["sig-smc-btc-1h-001", "sig-trend-btc-1h-002"],
  "entry_price": 45200.0,
  "stop_loss": 44700.0,
  "take_profit": 45700.0,
  "position_size": 0.1,
  "risk_amount": 50.0,
  "risk_percentage": 0.01,
  "leverage": 1.0,
  "confidence": 0.8,
  "reason": "Strong bullish structure with demand zone retest, EMA support confluence, and RSI divergence confirmation"
}